{
  "schema_version": 1,
  "run_id": "example-hello-colocation-fixed",
  "simulation_mode": "online",
  "system_architecture": "co-location",
  "prefix_cache": {"enabled": false, "key_mode": "session"},
  "cluster_scheduler": {"type": "round_robin"},
  "clusters": {
    "monolithic": {
      "parallelism": {
        "num_replicas": 1,
        "tensor_parallel_size": 1,
        "pipeline_parallel_size": 1,
        "data_parallel_size": 1,
        "moe_tensor_parallel_size": 1,
        "moe_expert_parallel_size": 1
      },
      "scheduler": {
        "type": "vllm_v1",
        "scheduling_policy": "fcfs",
        "batch_size_cap": 4,
        "max_tokens_in_batch": 16,
        "enable_preemption": true,
        "enable_chunked_prefill": true,
        "long_prefill_token_threshold": 0,
        "block_size": 4,
        "num_blocks": 64,
        "watermark_blocks_fraction": 0.0,
        "num_preallocate_tokens": 0
      },
      "gpu_memory": {"capacity_bytes_per_gpu": 288000000000},
      "execution_model": {"type": "fixed", "stage_latencies_ms": [0.5]},
      "model_name": "meta-llama/Llama-2-7b-hf",
      "moe_routing": {"mode": "simulation", "distribution": "balanced", "seed": 42}
    }
  }
}
